{
  "$schema": "https://json-schema.org/draft/2020-12/schema",
  "type": "object", "required": ["schema_version", "catalog_version", "generator_version", "documents"], "additionalProperties": false,
  "properties": {"schema_version": {"const": "1.0"}, "catalog_version": {"const": "1.0"}, "generator_version": {"const": "1.0.0"}, "documents": {"type": "array", "minItems": 5, "maxItems": 5, "items": {"type": "object", "required": ["document_id", "filename", "title", "description", "category", "format", "version", "effective_date", "owner_area", "owner_contact", "language", "classification", "fictitious", "source_type", "canonical_source", "locator_strategy", "sha256", "byte_size"], "properties": {"document_id": {"type": "string"}, "filename": {"type": "string"}, "title": {"type": "string"}, "description": {"type": "string"}, "category": {"type": "string"}, "format": {"enum": ["pdf", "csv"]}, "version": {"const": "1.0"}, "effective_date": {"const": "2026-01-01"}, "owner_area": {"type": "string"}, "owner_contact": {"type": "string"}, "language": {"const": "pt-BR"}, "classification": {"const": "public-demo-fictitious"}, "fictitious": {"const": true}, "source_type": {"const": "generated-from-canonical"}, "canonical_source": {"type": "string", "pattern": "^knowledge_base/"}, "locator_strategy": {"type": "string"}, "sha256": {"type": "string", "pattern": "^[0-9a-f]{64}$"}, "byte_size": {"type": "integer", "minimum": 1}, "page_count": {"type": "integer", "minimum": 2}, "row_count": {"type": "integer", "minimum": 1}}, "allOf": [{"if": {"properties": {"format": {"const": "pdf"}}}, "then": {"required": ["page_count"], "not": {"required": ["row_count"]}}}, {"if": {"properties": {"format": {"const": "csv"}}}, "then": {"required": ["row_count"], "not": {"required": ["page_count"]}}}], "additionalProperties": false}}}
}
