{
  "schema_version": "1.0",
  "catalog_version": "1.0",
  "generator_version": "1.0.0",
  "documents": [
    {
      "document_id": "NSI-POL-OPS-001",
      "title": "Política de Cancelamentos e Reagendamentos",
      "description": "Orientação administrativa fictícia para solicitações de cancelamento e reagendamento.",
      "category": "operational-policy",
      "format": "pdf",
      "version": "1.0",
      "effective_date": "2026-01-01",
      "owner_area": "Área de Relacionamento",
      "owner_contact": "relacionamento@nexosaude.example",
      "language": "pt-BR",
      "classification": "public-demo-fictitious",
      "fictitious": true,
      "source_type": "generated-from-canonical",
      "locator_strategy": "page-and-section",
      "filename": "politica_cancelamentos_reagendamentos_v1_0.pdf",
      "canonical_source": "knowledge_base/canonical/policies/politica_cancelamentos_reagendamentos.json",
      "sha256": "d91f0dc00a417155ffa9b9cf1255ea887371eebf7478042e948c553f11c9a072",
      "byte_size": 8795,
      "page_count": 2
    },
    {
      "document_id": "NSI-POL-PEO-001",
      "title": "Política de Férias e Benefícios",
      "description": "Orientação administrativa fictícia sobre planejamento de férias e consulta de benefícios.",
      "category": "people-policy",
      "format": "pdf",
      "version": "1.0",
      "effective_date": "2026-01-01",
      "owner_area": "Área de Pessoas",
      "owner_contact": "pessoas@nexosaude.example",
      "language": "pt-BR",
      "classification": "public-demo-fictitious",
      "fictitious": true,
      "source_type": "generated-from-canonical",
      "locator_strategy": "page-and-section",
      "filename": "politica_ferias_beneficios_v1_0.pdf",
      "canonical_source": "knowledge_base/canonical/policies/politica_ferias_beneficios.json",
      "sha256": "224c2925f1040ce09298feffcaac05da3091538ceda4434f4ed9e40189380948",
      "byte_size": 8678,
      "page_count": 2
    },
    {
      "document_id": "NSI-POL-PRV-001",
      "title": "Política de Privacidade e Proteção de Dados",
      "description": "Orientação educacional fictícia sobre privacidade e proteção administrativa de dados.",
      "category": "privacy-policy",
      "format": "pdf",
      "version": "1.0",
      "effective_date": "2026-01-01",
      "owner_area": "Área de Privacidade",
      "owner_contact": "privacidade@nexosaude.example",
      "language": "pt-BR",
      "classification": "public-demo-fictitious",
      "fictitious": true,
      "source_type": "generated-from-canonical",
      "locator_strategy": "page-and-section",
      "filename": "politica_privacidade_protecao_dados_v1_0.pdf",
      "canonical_source": "knowledge_base/canonical/policies/politica_privacidade_protecao_dados.json",
      "sha256": "d48427768a63dc35139b01d4d9c809c796f7472fd39cdff2a68fd8bef2071e3c",
      "byte_size": 8698,
      "page_count": 2
    },
    {
      "document_id": "NSI-TAB-COV-001",
      "title": "Convênios e Coberturas por Unidade",
      "description": "Diretório demonstrativo de coberturas administrativas por unidade fictícia.",
      "category": "coverage-directory",
      "format": "csv",
      "version": "1.0",
      "effective_date": "2026-01-01",
      "owner_area": "Área de Operações",
      "owner_contact": "operacoes@nexosaude.example",
      "language": "pt-BR",
      "classification": "public-demo-fictitious",
      "fictitious": true,
      "source_type": "generated-from-canonical",
      "locator_strategy": "header-and-row",
      "filename": "convenios_coberturas_por_unidade_v1_0.csv",
      "canonical_source": "knowledge_base/canonical/tables/convenios_coberturas_unidades.json",
      "sha256": "abaea0da0ac519d03840e371b0598fc66cd3900ee8919a1c0c50def2c9e5b407",
      "byte_size": 2746,
      "row_count": 12
    },
    {
      "document_id": "NSI-TAB-DIR-001",
      "title": "Diretório de Áreas, Responsáveis e Contatos",
      "description": "Diretório corporativo fictício de áreas e canais administrativos.",
      "category": "contact-directory",
      "format": "csv",
      "version": "1.0",
      "effective_date": "2026-01-01",
      "owner_area": "Área de Administração",
      "owner_contact": "administracao@nexosaude.example",
      "language": "pt-BR",
      "classification": "public-demo-fictitious",
      "fictitious": true,
      "source_type": "generated-from-canonical",
      "locator_strategy": "header-and-row",
      "filename": "diretorio_areas_responsaveis_contatos_v1_0.csv",
      "canonical_source": "knowledge_base/canonical/tables/diretorio_areas_responsaveis.json",
      "sha256": "65594663aadc9a01c3305e8892b55ad02d29cfdda46ecf651237ea211053490b",
      "byte_size": 1413,
      "row_count": 8
    }
  ]
}
